{
  "version": 2,
  "enabled": true,
  "dryRun": false,
  "notificationEmail": "sharankasandula@gmail.com",
  "campaignName": "Whatsapp Leads -1",
  "dailyBudgetTargetInr": 180,
  "reporting": {
    "dailyEmailEnabled": false,
    "dailyEmailHourIst": 24,
    "weeklyEmailDayIso": 6,
    "callConversionActionName": "Clicks to call",
    "optimizationScoreFloor": 0.9
  },
  "monitoring": {
    "lookbackDays": 7,
    "dailySummaryTopRows": 10,
    "includeSearchTerms": true,
    "includeKeywords": true
  },
  "thresholds": {
    "maxAvgCpcInr": 60,
    "minClicksBeforeAutoPause": 3,
    "lowCtrThreshold": 0.01,
    "minImpressionsForCtrAlert": 100,
    "costPerLeadAlertInr": 500,
    "dailySpendAlertMultiplier": 1.5
  },
  "automation": {
    "autoPauseHighCpcKeywords": false,
    "autoAlertLowCtrKeywords": true,
    "autoAddSafeNegativeTerms": true,
    "negativeMatchType": "PHRASE"
  },
  "safeNegativeTerms": [
    "course",
    "jobs",
    "salary",
    "free",
    "youtube",
    "pdf",
    "meaning",
    "definition",
    "wikipedia",
    "equipment",
    "buy",
    "amazon",
    "speech therapy",
    "prorehab",
    "matrix physiotherapy",
    "myo physio care",
    "reliva kondapur",
    "reliva",
    "matrix physio",
    "matrix physio clinic",
    "prorehab physiotherapy",
    "therapy partners",
    "therapy partners physiotherapy",
    "granth healthcare",
    "kinesis physio clinic",
    "kinesis physiotherapy",
    "rehab institute of movement sciences",
    "cure and sure physiotherapy",
    "cure & sure physiotherapy",
    "aruna physiotherapy",
    "aruna rehab clinic",
    "pal physiotherapy",
    "pal sports rehab",
    "core clinical physiotherapy",
    "lakshmi priya physiotherapy",
    "piyush sureka",
    "dr piyush sureka",
    "momentum sports clinic",
    "sneha tiwari",
    "dr sneha tiwari",
    "osteoxpert",
    "activerehab chiropractic",
    "active rehab chiropractic",
    "align tesla advanced physiotherapy",
    "care n cure physiotherapy",
    "care n cure"
  ],
  "safeNegativeRules": [
    {
      "term": "maha's fisiolife best physiotherapy clinic sports physiotherapist shockwave therapy home care physiotherapy vanasthalipuram",
      "matchType": "EXACT",
      "note": "Exact branded competitor query; Maha's Fisiolife is a physiotherapy clinic in Vanasthalipuram, Hyderabad."
    },
    {
      "term": "dr manoj physiotherapist",
      "matchType": "EXACT",
      "note": "Exact named-provider query; live results identify Dr Manoj physiotherapy practices in Hyderabad."
    },
    {
      "term": "dr priyanka physiotherapist",
      "matchType": "EXACT",
      "note": "Exact named-provider query; live results identify Dr Priyanka physiotherapy practices in Hyderabad."
    },
    {
      "term": "thrive pain clinic wellness and more rai durg",
      "matchType": "EXACT",
      "note": "Exact branded provider query; Thrive Pain Clinic Wellness and More is listed in Raidurg, Hyderabad."
    },
    {
      "term": "maps google",
      "matchType": "EXACT",
      "note": "Navigation-only string"
    },
    {
      "term": "google map location",
      "matchType": "EXACT",
      "note": "Navigation-only string"
    },
    {
      "term": "maps my location",
      "matchType": "EXACT",
      "note": "Navigation-only string"
    },
    {
      "term": "live location map",
      "matchType": "EXACT",
      "note": "Navigation-only string"
    },
    {
      "term": "maps location",
      "matchType": "EXACT",
      "note": "Navigation-only string"
    },
    {
      "term": "current location",
      "matchType": "EXACT",
      "note": "Navigation-only string"
    },
    {
      "term": "maps hyderabad",
      "matchType": "EXACT",
      "note": "Navigation-only string"
    },
    {
      "term": "google map location now",
      "matchType": "EXACT",
      "note": "Navigation-only string"
    },
    {
      "term": "google maps location",
      "matchType": "EXACT",
      "note": "Navigation-only string"
    },
    {
      "term": "google location",
      "matchType": "EXACT",
      "note": "Navigation-only string"
    },
    {
      "term": "google maps",
      "matchType": "EXACT",
      "note": "Navigation-only string"
    },
    {
      "term": "open google maps",
      "matchType": "EXACT",
      "note": "Navigation-only string"
    },
    {
      "term": "near gym",
      "matchType": "EXACT",
      "note": "Navigation-only string"
    },
    {
      "term": "cult beeramguda",
      "matchType": "EXACT",
      "note": "Navigation-only string"
    },
    {
      "term": "nursing location",
      "matchType": "EXACT",
      "note": "Navigation-only string"
    },
    {
      "term": "star hospital",
      "matchType": "PHRASE",
      "note": "Verified search-quality cleanup 2026-09-05"
    },
    {
      "term": "wellness hospital",
      "matchType": "PHRASE",
      "note": "Verified search-quality cleanup 2026-09-05"
    },
    {
      "term": "nims hospital",
      "matchType": "PHRASE",
      "note": "Verified search-quality cleanup 2026-09-05"
    },
    {
      "term": "sayani surgicals",
      "matchType": "PHRASE",
      "note": "Verified search-quality cleanup 2026-09-05"
    },
    {
      "term": "nature cure hospital",
      "matchType": "PHRASE",
      "note": "Verified search-quality cleanup 2026-09-05"
    },
    {
      "term": "arogya hospital",
      "matchType": "PHRASE",
      "note": "Verified search-quality cleanup 2026-09-05"
    },
    {
      "term": "tx hospital",
      "matchType": "PHRASE",
      "note": "Verified search-quality cleanup 2026-09-05"
    },
    {
      "term": "empower physiotherapy clinic",
      "matchType": "PHRASE",
      "note": "Verified search-quality cleanup 2026-09-05"
    },
    {
      "term": "physiotherapy machine",
      "matchType": "PHRASE",
      "note": "Verified search-quality cleanup 2026-09-05"
    },
    {
      "term": "physiotherapy shop",
      "matchType": "PHRASE",
      "note": "Verified search-quality cleanup 2026-09-05"
    },
    {
      "term": "dr kk physio care hyderabad",
      "matchType": "EXACT",
      "note": "Exact other-provider navigation query; retain generic physiotherapy searches."
    },
    {
      "term": "nexus pain management center hyderabad",
      "matchType": "EXACT",
      "note": "Exact named other-provider query; retain generic pain-management searches."
    },
    {
      "term": "rebound rehabilitation physical therapy",
      "matchType": "EXACT",
      "note": "Exact named Rebound Rehabilitation provider query; official reboundrehab.com lists Florida locations."
    },
    {
      "term": "jubilee hills apollo hospital",
      "matchType": "EXACT",
      "note": "Exact other-provider hospital query; retain generic physio and hospital intent."
    },
    {
      "term": "onus hospital 697 sn reddy nagar keshava nagar saroor nagar east champapet hyderabad telangana 500035 india",
      "matchType": "EXACT",
      "note": "Exact named other-provider hospital query; unrelated to Sthira services."
    },
    {
      "term": "navya physiotherapy clinic",
      "matchType": "EXACT",
      "note": "Exact competitor clinic name from live search terms; block branded intent only."
    },
    {
      "term": "ss chambers near ysr statue 100 feet road ayyappa society madhapur reset neurotherapy and chiropractic wellness centre",
      "matchType": "EXACT",
      "note": "Exact competitor clinic query; unrelated branded neurotherapy/chiropractic intent."
    },
    {
      "term": "wellknox",
      "matchType": "PHRASE",
      "note": "Competitor rehab brand seen in live search terms; block branded variants only."
    },
    {
      "term": "brinnova hospital",
      "matchType": "EXACT",
      "note": "Exact branded competitor query; web evidence shows Brinnova Hospital Hyderabad."
    },
    {
      "term": "dr dheeraj pain relief and wellness centre",
      "matchType": "EXACT",
      "note": "Exact branded provider query; evidence from site/Practo/Justdial for Hyderabad clinic."
    },
    {
      "term": "physioheal physiotherapy hyderabad",
      "matchType": "EXACT",
      "note": "Exact branded competitor query; web evidence shows PhysioHeal Physio Rehab in Hyderabad."
    },
    {
      "term": "movement school physio clinics electrotherapy sports physiotherapist in vanasthalipuram hyderabad",
      "matchType": "EXACT",
      "note": "Exact branded competitor query; web evidence shows Movement School Physio Clinics in Vanasthalipuram."
    },
    {
      "term": "ps clinic kondapur",
      "matchType": "EXACT",
      "note": "Exact branded competitor query; web evidence shows PS Clinic, Kondapur."
    },
    {
      "term": "muralikrishna's physio clinic &rehab hyderabad",
      "matchType": "EXACT",
      "note": "Exact branded competitor query; web evidence shows Muralikrishna's Physio Clinic & Rehab in Hyderabad."
    },
    {
      "term": "starhealthrehab hyderabad",
      "matchType": "EXACT",
      "note": "Exact branded competitor query; web evidence shows Starhealthrehab in Hyderabad."
    },
    {
      "term": "shazeb hospital",
      "matchType": "EXACT",
      "note": "Exact branded competitor query; web evidence shows Shazeb Hospital in Hyderabad."
    },
    {
      "term": "skanda hospital nallagandla",
      "matchType": "EXACT",
      "note": "Exact branded competitor query; web evidence shows Skanda Hospitals in Nallagandla."
    },
    {
      "term": "sri sri wellbeing ayurveda and panchakarma clinic nallagandla",
      "matchType": "EXACT",
      "note": "Exact branded clinic query; web evidence shows Sri Sri Wellbeing Ayurveda and Panchakarma Clinic in Nalagandla."
    },
    {
      "term": "fit india physiotherapy and chiropractic centre hyderabad",
      "matchType": "EXACT",
      "note": "Exact competitor clinic name seen in live search terms; web evidence shows FIT INDIA Physio/Chiropractic Centre in Hyderabad."
    },
    {